manufacturer,numHelpful,rating,text,title,username,doRecommend,date
Amazon,0,4,I bought the Kindle Oasis for my wife as a 37th-anniversary gift. She enjoys reading and I thought that being able to adjust the text size would be very nice. She tried it for a few days and didn't care for it. She writes notes in the margins and wasn't happy with the way the Kindle did its notes. For just reading I think it would be a very nice product.,I liked it,oldjohnsr,TRUE,2017-07-19T00:00:00.000Z
Amazon,0,5,Was a gift to replace older one and she really likes this one. Light and the battery last much longer.,Upgrade gift for wife,jncneal,TRUE,2017-07-19T00:00:00.000Z
Amazon,6,5,Even when I’m outside in bright sunlight- the words of the book I’m reading are still crystal clear. That alone makes the Kindle Oasis worth what it cost me.The Kindle Oasis wakes up in just seconds- and any book I choose instantly opens- ready to be read.It is the perfect size and isn’t heavy or bulky. I really do read for hours at a time. Sometimes I pace the floor while I read. Sometimes I’m on my elliptical machine when I read. And sometimes I’m sitting down. No matter what I’m doing- the Kindle Oasis remains comfortable to hold- and it is always easy on my eyes.When I receive a book that is in PDF- most of the time I can enlarge the words. If it won’t allow me to enlarge the words- I can change the orientation of the page and the words are automatically larger. I am able to make notes on the book if needed- and I can highlight words and/or passages.My merlot leather cover is attractive. When I flip it open- it is just like opening the cover of a book.How to Make the Battery LastOn the Kindle Oasis page- it says that its “dual-battery charging system delivers months of battery life.” This was a huge thing for me. Instead of having to charge my tablet almost every day- I would be able to read for months without charging the Kindle!Is this how my Oasis has performed? Well- not so much. There are conditions that have to be met for the charge on your Oasis to last for two months.First- you have to limit your reading to thirty minutes a day. That one is impossible for me. There are days that I am only able to read for thirty minutes- but they don’t occur very often. My Kindle goes everywhere with me- and I use just about every spare moment to read.Second- the wireless needs to be turned off. That one is easy to do but not always easy to remember. The only time the wireless needs to be on is to download one or more books.Third- this is based on your light setting at 10. That is way too low for me. I keep my light setting anywhere from 16 to 18.I don’t limit my reading to thirty minutes a day- and I try to remember to keep my wireless turned off. My light setting is kept anywhere from 16 to 18- and I put my Kindle to sleep the second I’m done reading. So how long does a single charge last me? Ten days is the longest a charge has lasted me so far- but it would have kept a charge for several more days if I had remembered to turn my wireless off. Once I succeed in keeping my wireless off- I will let you know how long the charge lasts.Now- I don’t plug it in to charge as soon as the charge on the cover gets low. I allow my cover charge to go as low as it will possibly go and then the Kindle battery will start to drain since it can no longer charge from the cover. I allow it to drain down to about 50% before I plug the cover and Kindle into my computer to charge.The one thing that surprised me was that everything on the Oasis is in black and white. For some reason- I thought that maybe the book covers would appear in color. But since I bought the Oasis to read books on- color isn’t needed.Special offers do appear on my screen but only when my Kindle is going to sleep or waking up. They aren’t a distraction- and to be honest- they are kind of fun to look at. You can pay a higher price so they won’t appear on your Kindle if you would rather not see them.I asked myself some questions once I had my Kindle and knew just how it worked. If I had known before I bought my Kindle Oasis that the charge wouldn’t last for months- would I still have bought it? Yes- I would have. If I had known that everything would appear in black and white- would I still have bought it? Yes- I would have.,Reasons I Love My Kindle Oasis,ljbinion,TRUE,2016-12-10T00:00:00.000Z
Amazon,0,5,"With the cover attached- the battery lasts for a good- long period. With the cover detached (which is how I use it primarily)- the Oasis is so thin that it is almost weightless in your hand. The ability to switch hands (flip upside down) means one never seems to tire of holding the device to read a book, and- it fits into my pants pocket- again- perfect for traveling. The battery seems to last with heavy usage for at least several days- but I tend to reconnect the cover at night (I am assuming that helps to recharge the basic Oasis battery). Regardless- it was well worth replacing our older Kindle readers with the newer Oasis (we bought two).",Perfect for traveling,Geno,TRUE,2017-01-30T00:00:00.000Z
Amazon,0,5,It fits easily into smallest purse so it's always at hand when waiting in lines while traveling. Lightweight- especially without the case. Shape of back provides easy grip. Accelerometer allows it to be held in either hand. Would like to be able to charge the reader and the case separate- but that's a minor thing.,Great size for traveling,Bbshop,TRUE,2017-07-09T00:00:00.000Z
Amazon,1,5,New to eBooks and researched available eReaders and tablets. What I like best about the OASIS is the weight (lightest on the market)- battery life (measured in weeks not hours) and the capability to use it in bright sunlight. Recommend it for all.,Great eBooks reader,Rick,TRUE,2016-09-16T00:00:00.000Z
Amazon,0,5,I have had a Kindle for some time and was curious about the Oasis. It did not disappoint. It is very compact- even with the cover- and fits in a coat pocket. I really enjoy the size and the redesign which brings back hard buttons. Great device for home or on the go.,So happy,Jetsboy,TRUE,2017-02-24T00:00:00.000Z
Amazon,1,5,lightweight and convenient to use. love my new kindle,Great,merafa,TRUE,2016-06-01T00:00:00.000Z
Amazon,0,5,Got this for my wife and she loves it. Compact library on the go for an avid reader.,Library in my wife's purse,BestBuyer,TRUE,2017-02-09T00:00:00.000Z
Amazon,5,5,This is my 4th kindle and is easily the best one I've ever had. It is very comfortable to hold and is very compact. I was surprised how small it is but has the same screen size as my other kindles. It may look costly at first but remember you are getting a cover with additional battery.,Best kindle yet,somileo,TRUE,2016-05-28T00:00:00.000Z
Amazon,1,5,New to eBooks and researched available eReaders and tablets. What I like best about the OASIS is the weight (lightest on the market)- battery life (measured in weeks not hours) and the capability to use it in bright sunlight. Recommend it for all.,Great eBooks reader,Rick,TRUE,2016-09-16T00:00:00.000Z
Amazon,0,5,Was a gift to replace older one and she really likes this one. Light and the battery last much longer.,Upgrade gift for wife,jncneal,TRUE,2017-07-19T00:00:00.000Z
Amazon,0,5,Very lightweight and portable with excellent battery life.,Works Great,Purchaser1,TRUE,2017-06-30T00:00:00.000Z
Amazon,1,5,I thought long and hard about upgrading from my paperwhite- but decided to do so despite not beating able to actually see one in the store. I have owned a Kindle since the second generation version. This is by far my favorite. The look and feel are amazing. I don't regret the purchase one bit as I have the disposable income to do so- but for most the paperwhite will more than suffice at a significantly smaller price point.,Best Kindle Ever,ShowMeSenate,TRUE,2017-05-12T00:00:00.000Z
Amazon,13,5,'ve owned the Kindle Keyboard- 2nd generation Paperwhite and now the Oasis. I love the Oasis very much. The ergonomic design is wonderful and makes it a breeze to hold. It is so light -- that is the biggest killer feature of the Oasis. The 10 LEDs look fantastic and I love the return of page buttons. I've never had one where the screen is flush with the bezel so this is great. All in all- this is easily the best Kindle ever made and even though it's a bit spendy- it will be the one future Kindles are measured against.,The definitive Kindle.,Chris,TRUE,2016-05-10T00:00:00.000Z
Amazon,5,5,This is my 4th kindle and is easily the best one I've ever had. It is very comfortable to hold and is very compact. I was surprised how small it is but has the same screen size as my other kindles. It may look costly at first but remember you are getting a cover with additional battery.,Best kindle yet,somileo,TRUE,2016-05-28T00:00:00.000Z
Amazon,1,1,"This is not an upgrade by any means! My three year old kindle outperformed Oasis.Battery life better than a week with the lights on lowest setting Magnetic connector is poorly designed and grows weak Two pieces to keep up with, unsnaps constantly Amazon Customer Services promises it will resolved in an update",Horrible Battery Life,Jus10nHouston,FALSE,2017-03-09T00:00:00.000Z
Amazon,0,5,Wife love it- reads a lot and this is her go to reader.,great product,1244,TRUE,2016-11-25T00:00:00.000Z
Amazon,0,5,Bought for my wife to upgrade from the original Kindle that she has worn out. Big step up from the original and should be good for another 8-10 years.,Great E-Reader,Olds442,TRUE,2016-12-07T00:00:00.000Z
Amazon,0,5,Actually easier to hold than a paperback- and might even be lighter!,The lightest ereader by far!,FloridaOleFart,TRUE,2016-05-27T00:00:00.000Z
Amazon,0,4,Excellent reader night or day- sunshine or shade. Not as full function as earlier kindels,Excellent Reader,TRLPEACH,TRUE,2016-08-26T00:00:00.000Z
